<?xml version="1.0" encoding="UTF-8"?>
<!DOCTYPE Magacin System "magacin.dtd">
<Magacin xmlns="http://www.w3schools.com"
xmlns:xsi="http://www.w3.org/2001/XMLSchema-instance"
xsi:schemaLocation="http://www.w3schools.com magacin.xsd">
<Artikal>
    <Naziv sifra="1">Jogurt</Naziv>
    <DatumIzrade>
        <Dan>3</Dan>
        <Mesec>7</Mesec>
        <Godina>2010</Godina>
    </DatumIzrade>
    <Cena tip="din">120</Cena>
    <Kompanija>
        <ImeKompanije>Imlek</ImeKompanije>
        <Adresa>Beograd</Adresa>
    </Kompanija>
    <Email tip="sluzbeni">email@mail.com</Email>
    <Email tip="privatni">emailp@mail.com</Email>
</Artikal>